name;original_text;translated_text
TROUPE_HUNTER_WILD_MEET_NOCARAVAN;"Grrr.. bug, not flea. Why you must bother me? This spot is mine, fair fought and earned.&lt;hpage&gt;I won&#8217;t stay long, madam. Nor would I contest your right to this cave. I only ask what task causes you to perch alone atop these dank ducts?&lt;page&gt;Task? Mine is a work most important, but not for talking of here, where danger waits close. Soon, I depart, to seek fleas, my fellows, and join them.&lt;page&gt;Now... Grrr. You leave me! I go soon to seek other fleas. A flea alone is good, but fleas together is best! Till then, rest I need! Off, bug!";"Grrr.. serangga, bukan kutu. Kenapa kamu harus mengganggu saya? Tempat ini milik saya, diperjuangkan dan didapatkan dengan adil. &lt;hpage&gt;Saya tidak akan tinggal lama, nyonya. Saya juga tidak akan menantang hak Anda atas gua ini. Saya hanya bertanya tugas apa yang menyebabkan Anda bertengger sendirian di atas saluran lembab ini? &lt;page&gt;Tugas? Tugas saya adalah pekerjaan yang paling penting, tetapi bukan untuk dibicarakan di sini, di mana bahaya menunggu dekat. Segera, saya pergi, untuk mencari kutu, teman-teman saya, dan bergabung dengan mereka. &lt;page&gt;Sekarang... Grrr. Anda tinggalkan saya! Saya akan segera pergi untuk mencari kutu-kutu lain. Kutu sendirian itu baik, tetapi kutu bersama adalah yang terbaik! Sampai saat itu, saya butuh istirahat! Pergi, serangga!"
TROUPE_LEADER_GAMES_INTRO_REOFFER;Dear friend... Miss Hornet! Forgive us, but we beg one more favour from you. Will you accompany us in our final act...?;Teman terkasih... Nona Hornet! Maafkan kami, tapi kami memohon satu bantuan lagi dari Anda. Maukah Anda menemani kami dalam tindakan terakhir kami...?
TROUPE_LEADER_GAMES_INTRO_ACCEPT_2;"It is time for the Festival of the Flea! One last, grand celebration before the black quakes pull us all down into the darkness!&lt;page&gt;Rouse yourself fleas, one last time! Let the games begin!";"Sudah waktunya untuk Festival Kutu! Satu perayaan terakhir dan agung sebelum gempa hitam menarik kita semua ke dalam kegelapan! &lt;page&gt;Bangkitlah kalian kutu, untuk yang terakhir kalinya! Biarkan permainan dimulai!"
TROUPE_LEADER_JUDGE_LEAVE;"Ahhh! Alas. Then we shall pray your own path remains safe.&lt;page&gt;And now, our new home is calling. We venture again!&lt;hpage&gt;Good travels, Fleamaster. May your journey ahead be safe and smooth.";"Ahhh! Sayang sekali. Maka kita akan berdoa agar jalan Anda sendiri tetap aman. &lt;page&gt;Dan sekarang, rumah baru kita memanggil. Kami berpetualang lagi! &lt;hpage&gt;Selamat bepergian, Fleamaster. Semoga perjalanan Anda ke depan aman dan lancar."
TROUPE_LEADER_COMPLETE_QUEST_SKIP_FULL;"But stranger! While you&#8217;re with us, you must hear of the miracle that has occurred!&lt;page&gt;See all these fleas gathered to our troupe? It seems so many! An impossible number, yet here they are, safely joined together. Our most cherished wishes answered!&lt;hpage&gt;If you were seeking fleas to join your caravan, I have found and freed many throughout my travels.&lt;page&gt;Oh! Can it be? Then you here are our saviour, our dear fleafriend! For all have made their way right, straight to us!&lt;page&gt;And now, with our caravan full to bursting, we&#8217;ve rested long enough. We fleas must head higher!&lt;page&gt;Oh, but saviour, how remiss of me! First, please tell, what shall we call you?&lt;hpage&gt;You may call me Hornet, Fleamaster. Know that I, like you, am glad to see your fellow fleas safe with your caravan. These are dangerous lands to travel alone.&lt;page&gt;Oh, vavenda! That is to say, incredible! What a beautiful thing it is! All of us together.&lt;page&gt;Dear friend... Miss Hornet. Our caravan prepares to depart toward the wide moor high above. Would you travel with us, as our honoured guest?";"Tapi orang asing! Saat Anda bersama kami, Anda harus mendengar keajaiban yang telah terjadi! &lt;page&gt;Lihatlah semua kutu yang berkumpul ke rombongan kami? Terlihat begitu banyak! Jumlah yang mustahil, namun di sini mereka, aman bergabung bersama. Keinginan kami yang paling berharga dijawab! &lt;hpage&gt;Jika Anda mencari kutu untuk bergabung dengan karavan Anda, saya telah menemukan dan membebaskan banyak di seluruh perjalanan saya. &lt;page&gt;Oh! Mungkinkah? Maka Anda di sini adalah penyelamat kami, teman kutu kami yang terkasih! Karena semua telah menemukan jalan mereka dengan benar, langsung kepada kami! &lt;page&gt;Dan sekarang, dengan karavan kita penuh hingga meledak, kita sudah cukup beristirahat. Kami kutu harus pergi lebih tinggi! &lt;page&gt;Oh, tapi penyelamat, betapa lalainya saya! Pertama, tolong katakan, kita panggil Anda siapa? &lt;hpage&gt;Anda bisa memanggil saya Hornet, Fleamaster. Ketahuilah bahwa saya, seperti Anda, senang melihat teman-teman kutu Anda aman bersama karavan Anda. Ini adalah tanah yang berbahaya untuk bepergian sendirian. &lt;page&gt;Oh, vavenda! Artinya, luar biasa! Sungguh hal yang indah! Kita semua bersama. &lt;page&gt;Teman terkasih... Nona Hornet. Karavan kita bersiap untuk berangkat menuju padang rumput yang luas di atas. Maukah Anda bepergian bersama kami, sebagai tamu terhormat kami?"
CARAVAN_LECH_SPA_INTIMIDATED;"Welcome back, my fierce one. Dodeshna! Heh heh! I&#8217;m sure your travels have wearied you.&lt;page&gt;Oh no, I wouldn&#8217;t dare take rosaries from such a treasured guest! Please, use my spa-carriage, free of charge! Dear Kratt is only too happy to provide!";"Selamat datang kembali, yang ganas. Dodeshna! Heh heh! Saya yakin perjalanan Anda telah membuat Anda lelah. &lt;page&gt;Oh tidak, saya tidak akan berani mengambil tasbih dari tamu yang begitu berharga! Tolong, gunakan kereta-spa saya, gratis! Kratt yang terkasih hanya terlalu senang untuk menyediakannya!"
FESTIVAL_OUTRO_PRE;"Miss Hornet! You have proven yourself the champion at each of our flea games!&lt;page&gt;I am confident now that the grand champion of our festival has emerged. It is none other than yourself, of course!&lt;page&gt;And thusly, must our final ceremony begin. Fleas, prepare yourselves!";"Nona Hornet! Anda telah membuktikan diri Anda sebagai juara di setiap permainan kutu kami! &lt;page&gt;Saya yakin sekarang bahwa juara agung festival kita telah muncul. Itu tidak lain adalah diri Anda sendiri, tentu saja! &lt;page&gt;Dan dengan demikian, upacara terakhir kita harus dimulai. Kutu, siapkan diri Anda!"
TROUPE_MEMBER_SHORT_MEET_FESTIVAL;"Good friend of fleas is you, Miss Hornet. Now must join and drink much. Be merry before all ends. Brew is made, enough for all!&lt;page&gt;No charge for you if needing more. Why waste when future is final?";"Teman baik kutu adalah Anda, Nona Hornet. Sekarang harus bergabung dan minum banyak. Bersukarialah sebelum semuanya berakhir. Brew dibuat, cukup untuk semua! &lt;page&gt;Tidak ada biaya untuk Anda jika butuh lebih banyak. Kenapa disia-siakan ketika masa depan adalah akhir?"
TROUPE_LEADER_INFO_LECH;"A strange flea has joined our troupe. All are welcome, but something about this one sets my fur to raise.&lt;page&gt;His carriage offers a steaming service, but the charge in rosaries is stiff, especially for us fleas who carry few.&lt;page&gt;For the companionship we provide, and the safety of our numbers, surely some discount is deserved?";"Seekor kutu aneh telah bergabung dengan rombongan kita. Semua dipersilakan, tetapi sesuatu tentang yang satu ini membuat bulu saya berdiri. &lt;page&gt;Keretanya menawarkan layanan uap, tetapi biayanya dalam tasbih sangat mahal, terutama bagi kami kutu yang membawa sedikit. &lt;page&gt;Untuk persahabatan yang kami berikan, dan keamanan jumlah kami, tentu saja beberapa diskon pantas didapatkan?"
FG_BOUNCE_COMPLETED_HIGHSCORE;Vikna! Dear one, you outdo yourself! To beat your previous high score is a marvel indeed!;Vikna! Sayangku, Anda melampaui diri Anda sendiri! Mengalahkan skor tertinggi Anda sebelumnya adalah keajaiban!
TROUPE_HUNTER_WILD_REPEAT;"You still here, bug not flea? Is rest I need before I leave for caravan. Not chat. You feel trouble-type. Make my shell tense.&lt;hpage&gt;I shall take my leave, madam. Stay strong on your own journey. May we meet again at the caravan, amongst your fellows.";"Kamu masih di sini, serangga bukan kutu? Saya butuh istirahat sebelum saya pergi ke karavan. Bukan mengobrol. Kamu terasa seperti tipe pembuat masalah. Membuat cangkang saya tegang. &lt;hpage&gt;Saya akan pergi, nyonya. Tetaplah kuat dalam perjalanan Anda sendiri. Semoga kita bertemu lagi di karavan, di antara teman-teman Anda."
FG_JUGGLE_DECLINE;Ah, of course. Perhaps you will be trying one of the other games?;Ah, tentu saja. Mungkin kamu mau mencoba permainan yang lain?
TROUPE_HUNTER_REPEAT_NOMAP;Grrr... bug not flea. Still wishing for knowings of my work? But you hold no map to mark! Until a map is owned, we have no trade to make.;Grrr... serangga bukan kutu. Masih ingin tahu tentang pekerjaan saya? Tapi kamu tidak punya peta untuk ditandai! Sampai peta dimiliki, kita tidak punya perdagangan untuk dilakukan.
CARAVAN_LECH_SPA_ACCEPT;"Thank you. Thank you! I&#8217;ll treasure these sweet-smelling rosaries dearly! Now, don&#8217;t be shy. Step inside!";Terima kasih. Terima kasih! Saya akan menghargai tasbih yang berbau manis ini! Sekarang, jangan malu-malu. Masuklah!
FG_BOUNCE_COMPLETED_CHAMP;"Vikna! My dear one, my dancer, the game has ended and you have proven yourself the champion!&lt;page&gt;None can best your score, you have shamed us all with your fearsome grace! But you will keep playing for me, yes?&lt;page&gt;The end of the world need not be a lonely thing... eheh heh...";"Vikna! Sayangku, penari saya, permainan telah berakhir dan Anda telah membuktikan diri Anda sebagai juara! &lt;page&gt;Tidak ada yang bisa mengalahkan skor Anda, Anda telah mempermalukan kita semua dengan keanggunan Anda yang menakutkan! Tapi Anda akan terus bermain untuk saya, kan? &lt;page&gt;Akhir dunia tidak harus menjadi hal yang kesepian... eheh heh..."
TROUPE_LEADER_QUEST1_TRAVEL_ACCEPT;Excellent, excellent! Let us make preparations and be off without delay! Rouse yourself fleas, for the caravan roams once more!;Bagus, bagus! Mari kita buat persiapan dan segera berangkat! Bangkitlah kalian kutu, karena karavan berkeliaran sekali lagi!
FG_BOUNCE_INTRO_REPEAT;My dear, will you play Flea Bounce for me once more? Leap up and bounce on the fleas who fly past for as long as you are able!;"Katakan dodeshna kepada kutu baru yang duduk di sana? Dia pendiam, tetapi sangat pandai bermain game! &lt;page&gt;Jangan khawatir tentang dia, Grishkin akan menjaganya. Akan mengisinya dengan brew dan mempertemukannya dengan semua kutu lainnya."
TROUPE_MEMBER_SHORT_SETH;"Say you dodeshna to the new flea sitting there? Is quiet one, but is very good at games!&lt;page&gt;Have no worry for him, Grishkin will look after. Will fill him with brew and meet him to all the other fleas.";"Katakan kau dodeshna pada kutu baru yang duduk di sana? Dia pendiam, tapi sangat jago bermain!&lt;page&gt;Jangan khawatirkan dia, Grishkin akan menjaganya. Akan kuberi dia minuman dan kutemukan dia bersama kutu-kutu lainnya."
TROUPE_LEADER_REPEAT_JUDGE;"Here we shall remain, for a time, Miss Hornet, and pray that more lost fleas find their way to us.&lt;hpage&gt;What others I encounter, I shall send your way, Fleamaster.";"Di sini kita akan tetap, untuk sementara waktu, Nona Hornet, dan berdoa agar lebih banyak kutu yang hilang menemukan jalan mereka kepada kita. &lt;hpage&gt;Apa pun yang saya temui, saya akan mengirimkannya kepada Anda, Fleamaster."
FESTIVAL_POT_TAKE_BREW;Take Flea Brew?;Ambil Flea Brew?
FESTIVAL_BOARD_TITLE_BOUNCE;Bounce;Bounce
TROUPE_LEADER_ALLRESCUED;"&lt;hpage&gt;That is well, Fleamaster. My travels through this land have been far and deep, and yet at almost every reach I met the friendly, inquisitive presence of your kind.&lt;hpage&gt;You fleas have an uncommon desire for adventure which I find admirable, even if it is seldom matched by capability.&lt;hpage&gt;Though I am long accustomed to travelling alone, following your journey, and sharing some part in its progress has been a warm thing.&lt;page&gt;Ahh, and so happy too have you made we fleas!&lt;page&gt;I would be honoured to bestow one final gift unto you, miss Hornet, a treasure from fleakind&#8217;s glorious past. May it mark you forever as a friend to us all.";"Itu bagus, Fleamaster. Perjalanan saya melalui tanah ini telah jauh dan dalam, namun di hampir setiap jangkauan saya bertemu dengan kehadiran ramah dan ingin tahu dari jenis Anda.&lt;hpage&gt;Kalian para kutu memiliki keinginan yang tidak biasa untuk berpetualang yang saya anggap mengagumkan, meskipun itu jarang sebanding dengan kemampuan.&lt;hpage&gt;Meskipun saya sudah lama terbiasa bepergian sendirian, mengikuti perjalanan Anda, dan berbagi sebagian dari perkembangannya telah menjadi hal yang menghangatkan.&lt;page&gt;Ahh, dan betapa senangnya juga Anda membuat kami, para kutu!&lt;page&gt;Saya akan merasa terhormat untuk memberikan satu hadiah terakhir kepada Anda, Nona Hornet, sebuah harta dari masa lalu kutu yang mulia. Semoga itu menandai Anda selamanya sebagai teman bagi kami semua."
CARAVAN_LECH_SPA_ACCEPT_INTIMIDATED;The spa is yours, dear guest! And always open for one so considerate and kindly as yourself... eheh heh...;Spa itu milik Anda, tamu terkasih! Dan selalu terbuka untuk orang yang begitu bijaksana dan baik seperti Anda... eheh heh...
CARAVAN_LECH_SAVED_REPEAT;"With luck, my dear, we will meet again when I have joined the flea caravan.&lt;page&gt;My carriage hides a special secret I&#8217;d gladly to share with you when next we meet!";"Dengan keberuntungan, sayangku, kita akan bertemu lagi saat saya bergabung dengan karavan kutu.&lt;page&gt;Kereta saya menyembunyikan rahasia khusus yang dengan senang hati saya bagikan kepada Anda saat kita bertemu lagi!"
TROUPE_LEADER_GAMES_INTRO_ACCEPT_1;The pact is made then. Fellows! Steel yourself! It is time, it is time!;Paktanya dibuat kalau begitu. Teman-teman! Kuatkan diri kalian! Sudah waktunya, sudah waktunya!
TROUPE_MEMBER_TALL_FLEATOPIA_REPEAT;This long lake... Space is much more big here. Finally I have some quiet from the little fleas.;Danau yang panjang ini... Ruang di sini jauh lebih besar. Akhirnya saya mendapatkan sedikit ketenangan dari kutu-kutu kecil.
TROUPE_LEADER_QUEST1_TRAVEL_DECLINE;"Ahh, that is a shame, but I understand. I&#8217;m sure our roads will cross each other soon enough.&lt;page&gt;And now, we must be off! Rouse yourself, fleas. The caravan roams once more!";"Ahh, itu memalukan, tapi saya mengerti. Saya yakin jalan kita akan segera bertemu.&lt;page&gt;Dan sekarang, kita harus pergi! Bangkitlah, para kutu. Karavan berkeliaran sekali lagi!"
FG_JUGGLE_INTRO_GAMESCOMPLETE;The grand ceremony has ended, but still we play! Will you honour us with a display of Flea Juggle, Miss Grand Champion Hornet?;Upacara agung telah berakhir, tetapi kita masih bermain! Maukah Anda menghormati kami dengan pertunjukan Flea Juggle, Nona Juara Agung Hornet?
TROUPE_LEADER_GREYMOOR_TRAVEL;Wonderful! Wonderful! The fleas will be overjoyed to share this next journey with our favoured companion! Let us away!;Luar biasa! Luar biasa! Kutu-kutu akan sangat gembira untuk berbagi perjalanan berikutnya dengan teman favorit kita! Mari kita pergi!
FG_BOUNCE_ACCEPT;Mamashka! Let our beautiful game begin! Flea Bounce!;Mamashka! Biarkan permainan indah kita dimulai! Flea Bounce!
TROUPE_LEADER_JUDGE_READYTOLEAVE_NO_LAKE;"&lt;hpage&gt;Unfortunately not, Fleamaster. I have visited many of this kingdom&#8217;s caves and none would offer the safety and space you require.&lt;hpage&gt;If ever I come upon such a place, I will let you know.";"Sayangnya tidak, Fleamaster. Saya telah mengunjungi banyak gua di kerajaan ini dan tidak ada yang menawarkan keamanan dan ruang yang Anda butuhkan.&lt;hpage&gt;Jika suatu saat saya menemukan tempat seperti itu, saya akan memberi tahu Anda."
FESTIVAL_BOARD_SPIRIT_NAME;Flealia;Flealia
FG_JUGGLE_INTRO_FIRST;"How do you like our festival, Miss Hornet? While the world crumbles around us, we will laugh and dance and frolick!&lt;page&gt;Make merry with us, and play some of the games of old!&lt;hpage&gt;My time is slim, Fleamaster. If I am to join your games, know it will be only to hone my skills for the greater trial I must soon face below.&lt;page&gt;Of course! Of course! Joy or learnings! Any reason is fine by us, Miss Hornet!&lt;page&gt;And look here, we have Flea Juggle, where the challenge is to strike fleas upwards and keep them airborne for as long as possible.&lt;page&gt;To have our treasured guest challenge this humble game would be an honour for us, truly!";"Bagaimana Anda menyukai festival kami, Nona Hornet? Sementara dunia hancur di sekitar kita, kita akan tertawa dan menari dan bersenang-senang!&lt;page&gt;Bergembiralah bersama kami, dan mainkan beberapa permainan lama!&lt;hpage&gt;Waktu saya sempit, Fleamaster. Jika saya harus bergabung dalam permainan Anda, ketahuilah itu hanya untuk mengasah keterampilan saya untuk uji coba yang lebih besar yang harus saya hadapi segera di bawah.&lt;page&gt;Tentu saja! Tentu saja! Kegembiraan atau pelajaran! Alasan apa pun baik-baik saja bagi kami, Nona Hornet!&lt;page&gt;Dan lihat di sini, kami memiliki Flea Juggle, di mana tantangannya adalah memukul kutu ke atas dan menjaga mereka tetap di udara selama mungkin.&lt;page&gt;Meminta tamu berharga kami menantang permainan sederhana ini akan menjadi suatu kehormatan bagi kami, sungguh!"
CARAVAN_LECH_WOUNDED_REPEAT;A mistake, treasured guest! Never again! Ohhh. Never again!;Sebuah kesalahan, tamu berharga! Jangan pernah lagi! Ohhh. Jangan pernah lagi!
TROUPE_HUNTER_MEET;"&lt;hpage&gt;Fair greetings again, large flea. Amongst all of your troupe, I had little doubt you would survive to reach this caravan.&lt;hpage&gt;Would you tell me now of the task that saw you so apart from your fellows, and so fearsome in form?&lt;page&gt;Grrr....Bug not flea! Mine is to track, by trail and smell and senses sharp. Find our friend fleas, our young most of most, to bring them together and grow them strong.&lt;hpage&gt;If you have sensed the locations of other lost fleas, share them with me. I may be able to send them safe to the caravan.&lt;page&gt;My learnings? Not free for you, bug not flea. Rosaries! Give those and I shall say of what I have sensed. Work like mine... much long, and hard. For that, I deserve some riches held.";"Salam lagi, kutu besar. Di antara semua rombongan Anda, saya tidak ragu Anda akan bertahan untuk mencapai karavan ini.&lt;hpage&gt;Maukah Anda memberi tahu saya sekarang tentang tugas yang membuat Anda begitu terpisah dari teman-teman Anda, dan begitu menakutkan dalam bentuk?&lt;page&gt;Grrr....Serangga bukan kutu! Tugas saya adalah melacak, melalui jejak dan bau dan indra yang tajam. Mencari teman-teman kutu kami, yang paling muda dari semuanya, untuk membawa mereka bersama dan membuat mereka tumbuh kuat.&lt;hpage&gt;Jika Anda telah merasakan lokasi kutu-kutu hilang lainnya, bagikan kepada saya. Saya mungkin bisa mengirim mereka dengan aman ke karavan.&lt;page&gt;Pelajaran saya? Tidak gratis untuk Anda, serangga bukan kutu. Tasbih! Berikan itu dan saya akan mengatakan apa yang telah saya rasakan. Pekerjaan seperti milik saya... sangat lama, dan sulit. Untuk itu, saya pantas mendapatkan beberapa kekayaan yang disimpan."
TROUPE_LEADER_REPEAT_FLEATOPIA_ACT3;"So many lost fleas have made it here... Truly, I&#8217;d never dared to hope we could gather such a grand company.&lt;page&gt;But, oh! The world has grown so dangerous, and there may be more lost fleas out there. I do so hope they can find their way to us!";"Begitu banyak kutu hilang yang berhasil sampai di sini... Sungguh, saya tidak pernah berani berharap kami bisa mengumpulkan rombongan sebesar ini.&lt;page&gt;Tapi, oh! Dunia telah menjadi sangat berbahaya, dan ada lebih banyak kutu hilang di luar sana. Saya sangat berharap mereka bisa menemukan jalan mereka kepada kami!"
TROUPE_LEADER_REPEAT_FLEATOPIA_ALLRESCUED_ACT3;"We fleas are all gathered, but now the world has loudly marked its ending! As great as our numbers grew, it seems our caravan will be the last.&lt;page&gt;There is only one thing left to do... but the preparations require time. If your travels wind their way back to us, dear friend, you yourself are welcome to participate...";"Kami, para kutu, semua sudah berkumpul, tetapi sekarang dunia telah dengan lantang menandai akhirnya! Meskipun jumlah kami tumbuh besar, tampaknya karavan kami akan menjadi yang terakhir.&lt;page&gt;Hanya ada satu hal yang tersisa untuk dilakukan... tetapi persiapannya membutuhkan waktu. Jika perjalanan Anda kembali kepada kami, teman terkasih, Anda sendiri dipersilakan untuk berpartisipasi..."
TROUPE_LEADER_FLEATOPIA_HUNTER_HINT;"Miss Hornet, I must tell, we&#8217;ve seen evidence nearby of a hunter of our tribe, a flea that seeks fleas!&lt;page&gt;As pungent and gruff as their sort often are, they&#8217;re still useful to have around a caravan.&lt;page&gt;A flea of their rare skill, settled among us, could offer defence and more.&lt;page&gt;If you&#8217;re still to be helping grow our town, search them out, up atop the muck choked ducts.";"Nona Hornet, saya harus memberitahu, kami telah melihat bukti di dekat sini tentang seorang pemburu dari suku kami, seekor kutu yang mencari kutu!&lt;page&gt;Meskipun jenis mereka sering kali tajam dan kasar, mereka tetap berguna di sekitar karavan.&lt;page&gt;Seekor kutu dengan keterampilan langka mereka, menetap di antara kami, bisa menawarkan pertahanan dan banyak lagi.&lt;page&gt;Jika Anda masih membantu mengembangkan kota kami, carilah mereka, di atas saluran yang tersumbat lumpur."
FESTIVAL_POT_INSPECT;A cauldron full of Flea Brew.;Sebuah kuali penuh dengan Flea Brew.
TROUPLE_HUNTER_MEET_COMPLETE;"&lt;hpage&gt;Fair greetings again, large flea. Of your many companions, I had little worry you would survive safe to find this caravan.&lt;hpage&gt;Would you tell me now of the task that saw you so apart from your fellows, and so fearsome in form?&lt;page&gt;Grrr....Mine was to track, by trail and smell and senses sharp. Find our friend fleas, our young most of most, to bring them together so strong they could grow.&lt;page&gt;A task once important, mine! But not now. All fleas are here, safe. A rare many! Time for toasts, and brew to fill our bellies!";"Salam lagi, kutu besar. Dari banyak teman Anda, saya tidak terlalu khawatir Anda akan bertahan dengan aman untuk menemukan karavan ini.&lt;hpage&gt;Maukah Anda memberi tahu saya sekarang tentang tugas yang membuat Anda begitu terpisah dari teman-teman Anda, dan begitu menakutkan dalam bentuk?&lt;page&gt;Grrr....Tugas saya adalah melacak, melalui jejak dan bau dan indra yang tajam. Mencari teman-teman kutu kami, yang paling muda dari semuanya, untuk membawa mereka bersama agar mereka bisa tumbuh kuat.&lt;page&gt;Tugas yang dulu penting, milik saya! Tapi tidak sekarang. Semua kutu ada di sini, aman. Jumlah yang langka! Waktunya untuk bersulang, dan brew untuk mengisi perut kita!"
TROUPE_LEADER_GREYMOOR_CANLEAVE;"Look here! All these lively fleas flocked to our caravan. Thanks to you and your hunting, our numbers grow grand. Mayhap, in time, we could grow to match even those caravans of our fabled past?&lt;hpage&gt;To see so many safe is a welcome sight, Fleamaster. Their playful cheer suggests you are a fine steward for the swelling troupe.&lt;page&gt;Such kind words, Miss Hornet! How lucky we are to have found a friend so fair!&lt;page&gt;But now, we must away! These moors have been our host long enough. It is time to climb and hoist towards drier caves!&lt;page&gt;Good friend to fleas, would you join us on this next journey? ";"Lihat di sini! Semua kutu yang lincah ini berbondong-bondong ke karavan kami. Berkat Anda dan perburuan Anda, jumlah kami tumbuh besar. Mungkin, seiring waktu, kita bisa tumbuh bahkan menyamai karavan-karavan dari masa lalu kita yang termasyhur?&lt;hpage&gt;Melihat begitu banyak yang aman adalah pemandangan yang disambut baik, Fleamaster. Keceriaan mereka yang menyenangkan menunjukkan bahwa Anda adalah pengurus yang baik untuk rombongan yang membengkak.&lt;page&gt;Kata-kata yang baik seperti itu, Nona Hornet! Betapa beruntungnya kami telah menemukan teman yang begitu baik!&lt;page&gt;Tapi sekarang, kita harus pergi! Padang rumput ini telah menjadi tuan rumah kita cukup lama. Sudah waktunya untuk mendaki dan menuju gua-gua yang lebih kering!&lt;page&gt;Teman yang baik bagi kutu, maukah Anda bergabung dengan kami dalam perjalanan berikutnya?"
FG_DODGE_COMPLETED_CHAMP;"Vikna. The trial has ended.&lt;page&gt;Bug not flea... impressive was your performance. Your score exceeds even my own.&lt;page&gt;To see skill so much, moments before everything ends, gives me unexpected joy.&lt;page&gt;Rishkiz... I congratulate you, champion.";"Vikna. Percobaan telah berakhir.&lt;page&gt;Serangga bukan kutu... penampilan Anda mengesankan. Skor Anda melebihi skor saya sendiri.&lt;page&gt;Melihat keterampilan yang begitu hebat, beberapa saat sebelum semuanya berakhir, memberi saya sukacita yang tak terduga.&lt;page&gt;Rishkiz... Saya mengucapkan selamat kepada Anda, juara."
FESTIVAL_BOARD_TITLE_DODGE;Dodge;Dodge
