name;original_text;translated_text
TROUPE_LEADER_GREYMOOR_MEET;"Ahh, Miss Hornet! Greetings, and well met, once again!&lt;page&gt;The journey here was long, but we didn&#8217;t lose a single flea! And now fate has brought us back together again... what a marvel!&lt;hpage&gt;It is good to see you safe, Fleamaster. The journey to this moor from the caverns below is long and dangerous.&lt;page&gt;Dangerous, certainly, but we fleas are born to roam!&lt;page&gt;And now, you must go and see Grishkin, sitting there by the bubbling cauldron. After long travel, we drink to revive our spirits!";"Ahh, Nona Hornet! Salam, dan senang bertemu, sekali lagi!&lt;page&gt;Perjalanan ke sini panjang, tapi kami tidak kehilangan satu pun kutu! Dan sekarang takdir telah membawa kita kembali bersama lagi... sungguh keajaiban!&lt;hpage&gt;Senang melihat Anda aman, Fleamaster. Perjalanan ke padang rumput ini dari gua-gua di bawah panjang dan berbahaya.&lt;page&gt;Berbahaya, tentu saja, tapi kami para kutu dilahirkan untuk berkeliaran!&lt;page&gt;Dan sekarang, Anda harus pergi dan menemui Grishkin, duduk di sana di samping kuali yang mendidih. Setelah perjalanan panjang, kami minum untuk membangkitkan semangat kami!"
TROUPE_HUNTER_WILD_MEET;"Grrr.. bug not flea. Why you must bother me? This spot is mine, fair fought and earned.&lt;hpage&gt;I won&#8217;t stay long, madam. Nor would I contest your right to this cave.&lt;hpage&gt;I have encountered several of your fellows fleas, united in a caravan. Perhaps you would consider joining with them?&lt;hpage&gt;Yours seems a hardy hide, and I fear alone they lack the strength to survive long in this land.&lt;page&gt;Caravan? Grrr. Felt it in my fur... Time for change. If caravan is close, then my task, these lands, may near be complete.&lt;page&gt;Now... Grrr. Much talk I gave. You leave me! Meet again at caravan, amongst good fellows. There I share my learnings of fleas and Pharloom. Till then, rest I need! Off, bug!";"Grrr.. serangga bukan kutu. Kenapa kamu harus mengganggu saya? Tempat ini milik saya, diperjuangkan dan didapatkan dengan adil.&lt;hpage&gt;Saya tidak akan tinggal lama, nyonya. Saya juga tidak akan menantang hak Anda atas gua ini.&lt;hpage&gt;Saya telah bertemu beberapa teman kutu Anda, bersatu dalam karavan. Mungkin Anda akan mempertimbangkan untuk bergabung dengan mereka?&lt;hpage&gt;Kulit Anda tampak kuat, dan saya khawatir sendirian mereka tidak memiliki kekuatan untuk bertahan lama di tanah ini.&lt;page&gt;Karavan? Grrr. Merasakannya di bulu saya... Waktunya untuk berubah. Jika karavan sudah dekat, maka tugas saya, di tanah ini, mungkin hampir selesai.&lt;page&gt;Sekarang... Grrr. Saya banyak bicara. Anda tinggalkan saya! Mari bertemu lagi di karavan, di antara teman-teman baik. Di sana saya akan berbagi pelajaran saya tentang kutu dan Pharloom. Sampai saat itu, saya butuh istirahat! Pergi, serangga!"
TROUPE_LEADER_GAMES_INTRO_TALK_2;"Ohhhh! What other choice do we poor wretches have?! Cruel fate leaves us with only one last task...&lt;page&gt;Dear friend... Miss Hornet! Forgive us, but we beg one more favour from you. Will you accompany us in our final act...?";"Ohhhh! Pilihan lain apa yang kami miliki, orang-orang malang ini?! Takdir kejam meninggalkan kami hanya dengan satu tugas terakhir...&lt;page&gt;Teman terkasih... Nona Hornet! Maafkan kami, tapi kami memohon satu bantuan lagi dari Anda. Maukah Anda menemani kami dalam tindakan terakhir kami...?"
FG_JUGGLE_COMPLETED_CHAMP;"Vikna! The game is ended, and we have a new Flea Juggle champion! Incredible!&lt;page&gt;Miss Hornet, with your skill I&#8217;m certain you could best all three of our games and become the grandest champion of them all!";"Vikna! Permainan telah berakhir, dan kita memiliki juara Flea Juggle baru! Luar biasa!&lt;page&gt;Nona Hornet, dengan keterampilan Anda, saya yakin Anda bisa mengalahkan ketiga permainan kami dan menjadi juara terbesar dari semuanya!"
CARAVAN_LECH_SAVED_ACT3;"My, what a sweet face now emerges from the darkness! Poor Kratt has been hiding here from those blackened beasts for too long, all alone!&lt;hpage&gt;The beasts and bugs ensnared by the black thread are dangerous indeed. You have done right to hide yourself from them, sir.&lt;hpage&gt;That metal carriage... It is yours, I assume?&lt;page&gt;Ooh, yes, yes! I&#8217;m setting out to join the nearest flea caravan, aren&#8217;t I? Safety in numbers, yes? I&#8217;ve had more than enough of venturing alone.&lt;page&gt;And you... I trust I will see you there? My carriage hides a special secret I&#8217;d gladly share with you when next we meet! Heh heh!";"Astaga, wajah yang manis sekarang muncul dari kegelapan! Kratt yang malang telah bersembunyi di sini dari binatang-binatang yang menghitam itu terlalu lama, sendirian!&lt;hpage&gt;Binatang dan serangga yang terjerat oleh benang hitam memang berbahaya. Anda telah melakukan hal yang benar untuk menyembunyikan diri dari mereka, tuan.&lt;hpage&gt;Kereta logam itu... Itu milik Anda, saya asumsikan?&lt;page&gt;Ooh, ya, ya! Saya akan pergi untuk bergabung dengan karavan kutu terdekat, bukan? Keamanan dalam jumlah, ya? Saya sudah lebih dari cukup berpetualang sendirian.&lt;page&gt;Dan Anda... saya yakin saya akan melihat Anda di sana? Kereta saya menyembunyikan rahasia khusus yang dengan senang hati saya bagikan kepada Anda saat kita bertemu lagi! Heh heh!"
TROUPE_LEADER_COMPLETE_QUEST1;"There are still many fleas for us to be united with though, and we&#8217;ve rested long enough. The caravan must head higher!&lt;page&gt;Oh but stranger, how remiss of me! I introduced myself earlier without ever asking for your own name. Forgive me! Please, what shall we call you?&lt;hpage&gt;You may call me Hornet, Fleamaster. Know that I, like you, am glad to see your fellow fleas safe with your caravan. These are dangerous lands to travel alone.&lt;hpage&gt;I still have a long journey ahead of me. If I come across any more fleas, I will assist where I am able.&lt;page&gt;Oh, vavenda! That is to say, incredible! What a beautiful thing for me to hear!&lt;page&gt;Dear friend... Miss Hornet. Our caravan must be away now, toward the wide moor high above. Would you travel with us, as our honoured guest?";"Masih banyak kutu untuk kita bersatu dengannya, dan kita sudah cukup beristirahat. Karavan harus pergi lebih tinggi!&lt;page&gt;Oh, tapi orang asing, betapa lalainya saya! Saya memperkenalkan diri saya lebih awal tanpa pernah menanyakan nama Anda sendiri. Maafkan saya! Tolong, kita panggil Anda siapa?&lt;hpage&gt;Anda bisa memanggil saya Hornet, Fleamaster. Ketahuilah bahwa saya, seperti Anda, senang melihat teman-teman kutu Anda aman bersama karavan Anda. Ini adalah tanah yang berbahaya untuk bepergian sendirian.&lt;hpage&gt;Saya masih memiliki perjalanan panjang di depan saya. Jika saya menemukan kutu lagi, saya akan membantu di mana saya bisa.&lt;page&gt;Oh, vavenda! Artinya, luar biasa! Sungguh hal yang indah bagi saya untuk didengar!&lt;page&gt;Teman terkasih... Nona Hornet. Karavan kita harus pergi sekarang, menuju padang rumput yang luas di atas. Maukah Anda bepergian bersama kami, sebagai tamu terhormat kami?"
TROUPE_MEMBER_TALL_FLEATOPIA;"So many awful places have us fleas travelled. Many times I almost die. But here is seems safe enough.&lt;page&gt;You will have rest too? Is space enough for us all now... friend.";"Begitu banyak tempat mengerikan yang kami para kutu telah jalani. Banyak kali saya hampir mati. Tapi di sini tampaknya cukup aman.&lt;page&gt;Anda akan beristirahat juga? Ada ruang yang cukup untuk kita semua sekarang... teman."
TROUPE_LEADER_MEET_JUDGE;"Welcome again, Miss Hornet! See how high our caravan has climbed, resting right on the doorstep of that mighty Citadel!&lt;hpage&gt;It is fortunate that all of your companions survive the trek, Fleamaster. The howling rise beside, and the tangled wood before it, have both claimed the lives of countless bugs.&lt;page&gt;Indeed! A perilous ascent! We have seen the many husks in passing. A mighty luck must shine on us, to journey with such success.";"Selamat datang lagi, Nona Hornet! Lihatlah seberapa tinggi karavan kita telah mendaki, beristirahat tepat di depan pintu Benteng yang perkasa itu!&lt;hpage&gt;Beruntung bahwa semua teman Anda selamat dari perjalanan, Fleamaster. Peningkatan yang melolong di samping, dan hutan yang kusut di depannya, keduanya telah merenggut nyawa serangga yang tak terhitung jumlahnya.&lt;page&gt;Memang! Pendakian yang berbahaya! Kami telah melihat banyak bangkai saat melintas. Keberuntungan yang perkasa harus menyinari kita, untuk melakukan perjalanan dengan kesuksesan seperti itu."
TROUPE_LEADER_COMPLETE_QUEST1_INTRO;Look, look! So many fleas have joined the caravan! What a miracle! We can not thank you enough for honouring our humble wish!;Lihat, lihat! Begitu banyak kutu telah bergabung dengan karavan! Sungguh keajaiban! Kami tidak bisa cukup berterima kasih karena Anda telah menghormati keinginan sederhana kami!
TROUPE_HUNTER_MEET_ACT3;"You remain, bug not flea? Would you seek service of me, ehh? Mine is knowledge much, the places of the lost little ones, heard and smelt across the caves.&lt;page&gt;You help find! And bring! Best we come together, we fleas all... now that times turn dark...";"Anda tetap di sini, serangga bukan kutu? Maukah Anda mencari layanan dari saya, ehh? Pengetahuan saya banyak, tempat-tempat anak-anak kecil yang hilang, terdengar dan tercium di seluruh gua.&lt;page&gt;Anda membantu menemukan! Dan membawa! Terbaik kita berkumpul, kita semua para kutu... sekarang saat-saat berubah menjadi gelap..."
FG_BOUNCE_DECLINE;As you wish, sweet one. Shall we just rest here together on the shore of eternity instead?;Sesuai keinginan Anda, yang manis. Haruskah kita beristirahat di sini bersama di tepi keabadian sebagai gantinya?
CARAVAN_LECH_SPA_PROMPT;Enter spa?;Masuk spa?
FG_JUGGLE_ACCEPT;Mamashka! I am saying, let the game begin! Flea Juggle!;Mamashka! Saya katakan, biarkan permainan dimulai! Flea Juggle!
TROUPE_LEADER_MEET_FLEATOPIA_TRAVELED;"What a beautiful spot you&#8217;ve gifted us, Miss Hornet! Safe apart from the dark and death of the lands beside. A place for fleas to grow smart and strong.&lt;page&gt;Here we shall see our travels end, for in Pharloom there could be no finer place to settle.&lt;hpage&gt;I am glad the location suits, Fleamaster. It is a calming thing to know these many fleas may survive. Most bugs of Pharloom seem destined for far bleaker fates.&lt;page&gt;Indeed! A hopeful future awaits! And only because of yourself and your efforts. To commemorate our arrival, it would be my pleasure to perform a small service for you.&lt;page&gt;I have been learning to sew, and the little fleas have been gathering materials for me. I thought I could add an extra pocket to your tool pouch, to make your travels just a little easier.&lt;page&gt;A trifling favour, much less than you deserve, but still I hope it meets to your satisfaction!";"Sungguh tempat yang indah yang Anda berikan kepada kami, Nona Hornet! Aman terpisah dari kegelapan dan kematian tanah di samping. Sebuah tempat bagi kutu untuk tumbuh cerdas dan kuat.&lt;page&gt;Di sini kita akan melihat perjalanan kita berakhir, karena di Pharloom tidak mungkin ada tempat yang lebih baik untuk menetap.&lt;hpage&gt;Saya senang lokasinya cocok, Fleamaster. Sungguh menenangkan mengetahui banyak kutu ini bisa bertahan. Sebagian besar serangga di Pharloom tampaknya ditakdirkan untuk nasib yang jauh lebih suram.&lt;page&gt;Memang! Masa depan yang penuh harapan menanti! Dan itu hanya karena Anda dan usaha Anda. Untuk memperingati kedatangan kami, saya akan senang untuk melakukan layanan kecil untuk Anda.&lt;page&gt;Saya telah belajar menjahit, dan kutu-kutu kecil telah mengumpulkan bahan untuk saya. Saya pikir saya bisa menambahkan saku tambahan ke kantong alat Anda, untuk membuat perjalanan Anda sedikit lebih mudah.&lt;page&gt;Bantuan sepele, jauh lebih sedikit dari yang pantas Anda dapatkan, tapi tetap saya harap itu memenuhi kepuasan Anda!"
FG_BOUNCE_INTRO_CHAMP;My dear Flea Bounce champion, will you play with us again? Let us dance and fly above the waters until the world itself falls away!;Juara Flea Bounce saya yang terkasih, maukah Anda bermain dengan kami lagi? Mari kita menari dan terbang di atas air sampai dunia itu sendiri jatuh!
CARAVAN_LECH_ACT3_MEET;"Sweet one! What a delight to see you emerge from the horrible darkness now enveloping the world!&lt;page&gt;Poor Kratt feared he would have only his mangy fellow fleas for company at the end of everything. How kind of you to spend your last moments here with me!";"Yang manis! Sungguh menyenangkan melihat Anda muncul dari kegelapan mengerikan yang sekarang menyelimuti dunia!&lt;page&gt;Kratt yang malang takut dia hanya akan memiliki teman-teman kutu lusuhnya sebagai teman di akhir segalanya. Betapa baiknya Anda menghabiskan saat-saat terakhir Anda di sini bersama saya!"
FESTIVAL_BOARD_HORNET_NAME;Hornet;Hornet
TROUPE_LEADER_ACCEPTED_WISHWALL_QUEST1_FULL;"&lt;hpage&gt;Fleamaster, I took your request from the wishwall in the pilgrim camp. You are seeking fleas to join your caravan? I have found and freed many throughout my travels.&lt;page&gt;Oh yes, indeed! And look here, they all have made their way to us! So many gathered, it seems a miracle. Our wishes granted before even your promise was known!";"Fleamaster, saya mengambil permintaan Anda dari dinding harapan di kamp peziarah. Anda mencari kutu untuk bergabung dengan karavan Anda?&lt;page&gt;Oh ya, memang! Dan lihat di sini, mereka semua telah menemukan jalan mereka kepada kami! Begitu banyak yang berkumpul, tampaknya keajaiban. Keinginan kami terkabul bahkan sebelum janji Anda diketahui!"
FG_JUGGLE_COMPLETED;Vikna! The game is now ended, but you can play again, as much you wish... until the end of the world comes for us all!;Vikna! Permainan sekarang berakhir, tetapi Anda bisa bermain lagi, sebanyak yang Anda inginkan... sampai akhir dunia datang untuk kita semua!
TROUPE_LEADER_OFFER_QUEST1;"Stranger, will you hear my worry? The time has come for us fleas to find each other and travel together, as has happened through generations before.&lt;page&gt;The many fleas of this kingdom should be flocking to our caravan, but times have become dangerous. You feel it too, yes? Our poor cousins, out there, in hiding!&lt;page&gt;Would you, could you, help us find these poor, lost fleas? We daren&#8217;t continue our journey until some of the poor dears have found their way here to us!";"Orang asing, maukah Anda mendengar kekhawatiran saya? Waktunya telah tiba bagi kami para kutu untuk menemukan satu sama lain dan bepergian bersama, seperti yang telah terjadi selama beberapa generasi sebelumnya.&lt;page&gt;Banyak kutu di kerajaan ini harus berbondong-bondong ke karavan kami, tetapi waktu telah menjadi berbahaya. Anda merasakannya juga, ya? Sepupu-sepupu kita yang malang, di luar sana, bersembunyi!&lt;page&gt;Maukah Anda, bisakah Anda, membantu kami menemukan kutu-kutu yang malang dan hilang ini? Kami tidak berani melanjutkan perjalanan kami sampai beberapa dari yang malang telah menemukan jalan mereka ke sini kepada kami!"
TROUPE_TRAVEL_PROMPT;Travel with the Flea Caravan?;Bepergian dengan Karavan Kutu?
TROUPE_LEADER_GREYMOOR_LEAVE;"Alas, Miss Hornet! Until our paths cross again, our dearest wishes go with you.&lt;hpage&gt;Safe travels to you and your troupe, Fleamaster. ";"Sayang sekali, Nona Hornet! Hingga jalan kita bertemu lagi, doa terindah kami menyertai Anda.&lt;hpage&gt;Selamat bepergian untuk Anda dan rombongan Anda, Fleamaster."
FESTIVAL_OUTRO_POST;"And so the great ceremony has reached its climax and its grand champion has emerged!&lt;page&gt;Thank you for spending your last moments with us here, Miss Hornet.&lt;page&gt;Though the world will soon end, and our paradise will crumble, the memories of friendship we all shared shall surely echo through the oncoming void for all eternity!&lt;hpage&gt;Fleamaster, your sentiment is kind, but this world will not end.&lt;page&gt;Oh? How good of you to speak words of hope for our benefit, but we have accepted our fate. Come, let us forget the past and revel together!&lt;hpage&gt;It is not merely hope that I offer you sir, but a promise. This kingdom&#8217;s suffering has a singular cause, and by my own claw will it be cleansed.&lt;hpage&gt;Perhaps not every flea will survive what is coming... but the world will not die, and your settlement may still see chance to prosper.&lt;page&gt;Ahh? You speak... with such conviction. But I cannot bring myself to hope such, I am sorry.&lt;page&gt;Come what may, we fleas will be here until the end. And the games will continue, of course! Celebrate with us for as long as you wish, dear friend.";"Dan upacara besar telah mencapai puncaknya dan juara agungnya telah muncul!&lt;page&gt;Terima kasih telah menghabiskan saat-saat terakhir Anda bersama kami di sini, Nona Hornet.&lt;page&gt;Meskipun dunia akan segera berakhir, dan surga kita akan hancur, kenangan persahabatan yang kita semua bagikan pasti akan bergema melalui kehampaan yang akan datang untuk selamanya!&lt;hpage&gt;Fleamaster, sentimen Anda baik, tetapi dunia ini tidak akan berakhir.&lt;page&gt;Oh? Betapa baiknya Anda mengucapkan kata-kata harapan untuk keuntungan kami, tetapi kami telah menerima nasib kami. Ayo, mari kita lupakan masa lalu dan bersenang-senang bersama!&lt;hpage&gt;Bukan hanya harapan yang saya tawarkan kepada Anda, tuan, tetapi sebuah janji. Penderitaan kerajaan ini memiliki satu penyebab, dan dengan cakar saya sendiri itu akan dibersihkan.&lt;hpage&gt;Mungkin tidak setiap kutu akan bertahan dari apa yang akan datang... tetapi dunia tidak akan mati, dan pemukiman Anda mungkin masih memiliki kesempatan untuk makmur.&lt;page&gt;Ahh? Anda berbicara... dengan keyakinan seperti itu. Tetapi saya tidak bisa berharap seperti itu, saya minta maaf.&lt;page&gt;Apapun yang terjadi, kami para kutu akan berada di sini sampai akhir. Dan permainannya akan terus berlanjut, tentu saja! Rayakan bersama kami selama yang Anda inginkan, teman terkasih."
FG_JUGGLE_COMPLETED_CHAMP_TO_OUTRO;"Vikna! The game is ended, and we have a new Flea Juggle champion! Incredible!&lt;page&gt;You have proven yourself the champion at each of our flea games!&lt;page&gt;I am confident now that the grand champion of our festival has emerged. It is none other than yourself, of course!&lt;page&gt;And thusly, must our final ceremony begin. Fleas, prepare yourselves!";"Vikna! Permainan telah berakhir, dan kita memiliki juara Flea Juggle baru! Luar biasa!&lt;page&gt;Anda telah membuktikan diri Anda sebagai juara di setiap permainan kutu kami!&lt;page&gt;Saya yakin sekarang bahwa juara agung festival kita telah muncul. Itu tidak lain adalah diri Anda sendiri, tentu saja!&lt;page&gt;Dan dengan demikian, upacara terakhir kita harus dimulai. Kutu, siapkan diri Anda!"
TROUPE_HUNTER_CANCELED;You not want my learnings, bug not flea? Rare it is we share such things with ones outside our own. ;Anda tidak menginginkan pelajaran saya, serangga bukan kutu? Jarang kami berbagi hal-hal seperti itu dengan orang-orang di luar kaum kami sendiri.
FG_JUGGLE_CHOICE;Compete in Flea Juggle?;Bersaing di Flea Juggle?
FG_JUGGLE_INTRO_CHAMP;Miss Hornet, you are the greatest of us all in the Flea Juggle! But will you challenge yourself to ever higher achievements?;Nona Hornet, Anda adalah yang terhebat dari kita semua dalam Flea Juggle! Tapi maukah Anda menantang diri sendiri untuk pencapaian yang lebih tinggi?
TROUPE_MEMBER_TALL_MEET;"Dodeshna, stranger. You are looking a little... tired, is it? Unhealthy?&lt;page&gt;You can rest with us here, if wish. Is nice and dark, and warmth from below brings good health.&lt;page&gt;Still, you should make care not to stay much long. You are not flea, after all.";"Dodeshna, orang asing. Anda terlihat sedikit... lelah, ya? Tidak sehat?&lt;page&gt;Anda bisa beristirahat bersama kami di sini, jika mau. Bagus dan gelap, dan kehangatan dari bawah membawa kesehatan yang baik.&lt;page&gt;Namun, Anda harus berhati-hati untuk tidak tinggal terlalu lama. Bagaimanapun juga, Anda bukan kutu."
TROUPE_HUNTER_WILD_REPEAT_NOCARAVAN;"You still here, bug? Is rest I need before I travel. Not chat. You is trouble-type. Make my shell tense.&lt;hpage&gt;I shall take my leave, madam. Stay strong on your own journey. May we meet again in more hospitable surrounds.";"Kamu masih di sini, serangga? Saya butuh istirahat sebelum saya bepergian. Bukan mengobrol. Kamu terasa seperti tipe pembuat masalah. Membuat cangkang saya tegang.&lt;hpage&gt;Saya akan pergi, nyonya. Tetaplah kuat dalam perjalanan Anda sendiri. Semoga kita bertemu lagi di lingkungan yang lebih ramah."
TROUPE_LEADER_GREYMOOR_CANLEAVE_FULL;"Look Miss Hornet! See the many lively fleas that form our caravan. Thanks to you and your hunting, so many are here! And all are eager again to travel!&lt;page&gt;We had once wished to match the numbers of our fabled past, yet now, we may even have exceeded them!&lt;hpage&gt;It is a welcome sight, Fleamaster, and the playful cheer about the caravan suggests you are a fine steward to the troupe.&lt;page&gt;Such kind words, Miss Hornet! How lucky we are to have found a friend so fair!&lt;page&gt;But now, we must away! These moors have been our host long enough. It is time to climb and hoist towards drier caves!&lt;page&gt;Good friend to fleas, would you join us on this next journey? ";"Lihat Nona Hornet! Lihatlah banyak kutu yang lincah yang membentuk karavan kami. Berkat Anda dan perburuan Anda, begitu banyak yang ada di sini! Dan semua bersemangat lagi untuk bepergian!&lt;page&gt;Kami pernah berharap untuk menyamai jumlah karavan dari masa lalu kami yang termasyhur, namun sekarang, kami bahkan mungkin telah melebihi mereka!&lt;hpage&gt;Itu adalah pemandangan yang disambut baik, Fleamaster, dan keceriaan yang menyenangkan di sekitar karavan menunjukkan bahwa Anda adalah pengurus yang baik untuk rombongan.&lt;page&gt;Kata-kata yang baik seperti itu, Nona Hornet! Betapa beruntungnya kami telah menemukan teman yang begitu baik!&lt;page&gt;Tapi sekarang, kita harus pergi! Padang rumput ini telah menjadi tuan rumah kita cukup lama. Sudah waktunya untuk mendaki dan menuju gua-gua yang lebih kering!&lt;page&gt;Teman yang baik bagi kutu, maukah Anda bergabung dengan kami dalam perjalanan berikutnya?"
TROUPE_LEADER_JUDGE_TRAVEL;"Marvellous! We fleas shall be overjoyed to have your company on the road.&lt;page&gt;Now! Our new home is calling. We must travel!";"Luar biasa! Kami para kutu akan sangat gembira memiliki Anda di jalan.&lt;page&gt;Sekarang! Rumah baru kita memanggil. Kita harus bepergian!"
TROUPE_MEMBER_SHORT_REPEAT_GREYMOOR;"I&#8217;m wonder at this land... Something heavy hangs above, like shadow. I&#8217;m hope the little fleas have not much danger here...";Saya bertanya-tanya tentang tanah ini... Sesuatu yang berat menggantung di atas, seperti bayangan. Saya harap kutu-kutu kecil tidak terlalu banyak bahaya di sini...
TROUPE_LEADER_ACCEPTED_WISHWALL_QUEST1;"&lt;hpage&gt;Fleamaster, I took your request from the wishwall in the pilgrim camp. You are seeking fleas to join your caravan?&lt;page&gt;Oh, yes! The time has come for us fleas to find each other and travel together, as has happened through generations before.&lt;page&gt;The many fleas of this kingdom should be flocking to our caravan, but times have become dangerous. You feel it too, yes? Our poor cousins, out there, in hiding!&lt;page&gt;But... do I understand you rightly, stranger? You will help find the the poor, lost fleas? Truly?";"Fleamaster, saya mengambil permintaan Anda dari dinding harapan di kamp peziarah. Anda mencari kutu untuk bergabung dengan karavan Anda?&lt;page&gt;Oh, ya! Waktunya telah tiba bagi kami para kutu untuk menemukan satu sama lain dan bepergian bersama, seperti yang telah terjadi selama beberapa generasi sebelumnya.&lt;page&gt;Banyak kutu di kerajaan ini harus berbondong-bondong ke karavan kami, tetapi waktu telah menjadi berbahaya. Anda merasakannya juga, ya? Sepupu-sepupu kita yang malang, di luar sana, bersembunyi!&lt;page&gt;Tapi... apakah saya mengerti Anda dengan benar, orang asing? Anda akan membantu menemukan kutu-kutu yang malang dan hilang? Sungguh?"
TROUPE_LEADER_GREYMOOR_HAUNTEDBELLHART;"That great vein of bells there... some of the fleas wanted to shelter inside, but I was not so sure. The whole creaking mass seems unstable! It makes me tremble!&lt;hpage&gt;You were wise not to head inside, Fleamaster. A silken curse has taken hold of the settlement within. Advise your fellows to avoid that place.&lt;page&gt;A curse you say?! W-well then! Our thanks are owed again. I shall let all fleas know they must not venture closer.";"Urat besar lonceng di sana... beberapa kutu ingin berlindung di dalam, tapi saya tidak begitu yakin. Seluruh massa yang berderit itu tampak tidak stabil! Itu membuat saya gemetar!&lt;hpage&gt;Anda bijak untuk tidak masuk ke dalam, Fleamaster. Kutukan sutra telah menguasai pemukiman di dalamnya. Sarankan teman-teman Anda untuk menghindari tempat itu.&lt;page&gt;Kutukan yang Anda katakan?! K-kalau begitu! Terima kasih kami berhutang lagi. Saya akan memberi tahu semua kutu bahwa mereka tidak boleh mendekat."
FG_DODGE_COMPLETED;Vikna. The trial has ended. Your score can be seen on the board beside me. ;Vikna. Percobaan telah berakhir. Skor Anda dapat dilihat di papan di samping saya.
